{
  "affected_paths": [
    "src/validator.py",
    "tests/test_validator.py"
  ],
  "assumptions": [
    {
      "confidence": "VERIFIED",
      "evidence": [
        "fixture.md"
      ],
      "text": "Fixture evidence defines the planning boundary."
    }
  ],
  "classification": "ISOLATED",
  "created_at": "2026-07-12T18:00:00Z",
  "evidence": [
    "fixture.md"
  ],
  "goal_hash": "sha256:9e22a49c76c563785626ee642c72cb015b7cdc5cb53aab98af6f4c30799f9115",
  "markdown_hash": "sha256:9a68c8bae7cc1836110d5def873c17264c851494ab196aadffb64ca5c7fcebfd",
  "risk": "LOW",
  "schema_version": "1.1.0",
  "unknowns": []
}
